{"as_of":"2026-08-20","non_claims":["NO_CRYPTOGRAPHIC_REVIEWER_IDENTITY","REVIEW_IS_NOT_SEMANTIC_DONE","NO_FACTORY_V1_OPERATIONAL_READY","NO_ALPHA_OR_CASHFLOW","NO_ATOM_2","NO_CANONICAL_DONE","NO_VPS_PURCHASE_OR_DEPLOY","NO_SCIENTIFIC_RECLASSIFICATION_OF_PR_156","NO_RECAPTURE","NO_TRADED_ONLY_RESCUE","NO_CONFIRMATORY_JUPITER_CAPTURE"],"required_roles":["ARCHITECTURE_CRITIC","CODE_REVIEWER","GOAL_DOD_CRITIC"],"review_id":"QUOTE-SURFACE-RETENTION-CLOCK-QUALIFY-INDEPENDENT-REVIEW-001","reviewed_bindings_sha256":"7519a9cd799338ae423c3e90240eea42163fa95ac68cc0419e9e3bdb952c63be","reviewed_inventory_sha256":"3aaa95b01a4d425be1614a2cc5acf7c1eaa10856e614d5a0e8f4eb69ed88d49c","reviews":[{"findings":["CHECKED_CLOCK_VALID_NOT_AMOUNT_PROXY","CHECKED_EQUAL_OUTAMOUNT_REMAINS_CLOCK_VALID","CHECKED_OVERLAY_DOES_NOT_RESCORE_CONSUMED_156","CHECKED_NO_KEY_IN_GIT","CHECKED_NO_CONFIRMATORY_YAML","CHECKED_QUALIFICATION_PACKET_HAS_NO_SCIENTIFIC_TERMINAL"],"role":"CODE_REVIEWER","verdict":"PASS"},{"findings":["CHECKED_NAMED_CONSUMER_PROJECTOR_COUNTS_5_6_1","CHECKED_NAIVE_APPLY_NOT_PUBLISHED","CHECKED_DIFFERENT_AMOUNT_SAME_CLOCK_NOT_TIME_SEPARATED","CHECKED_NO_ATOM2","CHECKED_NO_RECAPTURE","CHECKED_ENGINEERING_QUALIFICATION_ONLY"],"role":"GOAL_DOD_CRITIC","verdict":"PASS"},{"findings":["CHECKED_DUE_H3600_GT_DUE_H900","CHECKED_BUY_H900_IN_CELL_CLOCK","CHECKED_FROZEN_156_TERMINAL_NOT_OVERLAID","CHECKED_NO_ROUTE_PATH_RISK_NOT_ZERO","CHECKED_KEEP_VETO_YAML_UNCHANGED","CHECKED_NO_CONFIRMATORY_CAPTURE_WIRING"],"role":"ARCHITECTURE_CRITIC","verdict":"PASS"}],"schema":"smial.delivery-independent-review-evidence","schema_version":"1.0","task_id":"QUOTE_SURFACE_RETENTION_CLOCK_QUALIFY_V1","verdict":"PASS"}
