{
  "as_of": "2026-08-22",
  "non_claims": [
    "NO_CRYPTOGRAPHIC_REVIEWER_IDENTITY",
    "REVIEW_IS_NOT_SEMANTIC_DONE",
    "NO_CANONICAL_DONE",
    "NO_SINGLE_AGENT_REVIEW_FALLBACK",
    "NO_EARN_SHADOW",
    "NO_ALPHA",
    "NO_NETRETURN",
    "NO_FACTORY_V1_OPERATIONAL_READY"
  ],
  "required_roles": [
    "ARCHITECTURE_CRITIC",
    "CODE_REVIEWER",
    "GOAL_DOD_CRITIC"
  ],
  "review_id": "EARLY-STRUCTURAL-BACKING-PIT-INDEPENDENT-REVIEW-001",
  "reviewed_bindings_sha256": "5bda730f9455619999b7d893f1374ac075f070edeb5cad4ab1edaf665923601a",
  "reviewed_inventory_sha256": "514e09885b7790ce757df875c9e09fa88424600ce195d13c2ca7eea4e1f0f2bc",
  "reviews": [
    {
      "findings": [
        "CHECKED_RUNNER_UNCHANGED",
        "CHECKED_PHRASE_GATE_ZERO_CALLS",
        "CHECKED_UNKNOWN_NOT_ZERO",
        "CHECKED_FDV_REJECTED",
        "CHECKED_ICP_AGE_LIQ",
        "CHECKED_NO_SECRETS_IN_RECEIPT",
        "CHECKED_WINDOW_A_CLOSE_NO_B",
        "FIXED_PRIVATE_PARSE_IMPORT_INLINED",
        "FIXED_ICP_YAML_PIN_IN_VALIDATE",
        "RESIDUAL_CLOSE_SUBTYPE_NOT_SPLIT"
      ],
      "role": "CODE_REVIEWER",
      "verdict": "PASS"
    },
    {
      "findings": [
        "CHECKED_DECISION_DELTA",
        "CHECKED_NAMED_CONSUMER_ATOM2_COMMISSIONING_ONLY",
        "CHECKED_CHEAPEST_FALSIFIER",
        "CHECKED_CLOSE_NOT_EARN_SHADOW",
        "CHECKED_NON_CLAIMS",
        "CHECKED_NO_CANONICAL_DONE",
        "CHECKED_DOD_AFTER_TRIO_BIND"
      ],
      "role": "GOAL_DOD_CRITIC",
      "verdict": "PASS"
    },
    {
      "findings": [
        "CHECKED_QUOTE_NE_FILL",
        "CHECKED_FDV_NE_MCAP",
        "CHECKED_FACTORY_BLAST_RADIUS_ZERO",
        "CHECKED_CREDENTIAL_ORDER",
        "FIXED_ICP_POLICY_PIN",
        "FIXED_NO_PRIVATE_UNDERSCORE_IMPORT",
        "RESIDUAL_MEU_AND_TAU_BOTH_TRUE_ON_CLOSE"
      ],
      "role": "ARCHITECTURE_CRITIC",
      "verdict": "PASS"
    }
  ],
  "schema": "smial.delivery-independent-review-evidence",
  "schema_version": "1.0",
  "task_id": "EARLY_STRUCTURAL_BACKING_PIT_COMMISSIONING_V1",
  "verdict": "PASS"
}
