{"as_of":"2026-08-19","non_claims":["NO_CRYPTOGRAPHIC_REVIEWER_IDENTITY","REVIEW_IS_NOT_SEMANTIC_DONE","NO_FACTORY_V1_OPERATIONAL_READY","NO_ALPHA_OR_CASHFLOW","NO_MOVE_3","NO_CANONICAL_DONE","NO_VPS_PURCHASE_OR_DEPLOY","NO_POST_HOC_THRESHOLD_SEARCH","NO_DEPLOYABLE_T0_POLICY"],"required_roles":["ARCHITECTURE_CRITIC","CODE_REVIEWER","GOAL_DOD_CRITIC"],"review_id":"PRIOR-GIT-T0-FRICTION-SCREEN-INDEPENDENT-REVIEW-001","reviewed_bindings_sha256":"e5b1004adec073ed11b5f660ff977a68c3e325e3ef95ec1dd033e9d4f04d0722","reviewed_inventory_sha256":"04e30b5de9ded94dcc5858e16dc0cd4326e9affffbb0bb5400cc52233a4fde48","reviews":[{"findings":["CHECKED_T0_SCREEN_OVERLAY_ON_LIVE_RECEIPT","CHECKED_AUDITION_TERMINAL_PRESERVED","CHECKED_NO_KEY_IN_RECEIPT","CHECKED_EXCLUSIONS_A1_MOVE2_COMMISSIONING_ATOM5","CHECKED_RUNNER_GENERIC","CHECKED_NO_RECAPTURE","CHECKED_NO_THRESHOLD_RESCUE","CHECKED_SPEC_LF_REBOUND","CHECKED_CATALOG_INTEGRITY_REBOUND","CHECKED_DELIVERY_EVIDENCE_BOUND_TO_THIS_ATOM_COMPLETION"],"role":"CODE_REVIEWER","verdict":"PASS"},{"findings":["CHECKED_NAMED_CONSUMER_GOT_CLOSE_VS_EXTEND","CHECKED_STRATUM_UNSTABLE_FAIL_CLOSED","CHECKED_NO_POST_HOC_THRESHOLD","CHECKED_FALSIFIER_RAN_ON_FRESH_COHORT","CHECKED_FROZEN_CUTOFF_NOT_ATOM5_MEDIAN"],"role":"GOAL_DOD_CRITIC","verdict":"PASS"},{"findings":["CHECKED_GIT_RECEIPT_IS_SCIENCE","CHECKED_NO_CORE_RUNNER_HYPOTHESIS_LOGIC","CHECKED_YAML_RULE_BOUND_ON_CAPTURE_PATH","CHECKED_KERNEL_PROVIDER_CALLS_FALSE","CHECKED_FAIL_CLOSED_PHRASE_GATE","CHECKED_CUTOFF_IS_PRIOR_GIT_COMPLETE_XY_X_NOT_LIVE_T0_ONLY_POLICY"],"role":"ARCHITECTURE_CRITIC","verdict":"PASS"}],"schema":"smial.delivery-independent-review-evidence","schema_version":"1.0","task_id":"PRIOR_GIT_T0_FRICTION_SCREEN_V1","verdict":"PASS"}
