{
  "schema": "smial.delivery-independent-review-evidence",
  "schema_version": "1.0",
  "review_id": "RC002-H11-CREATE-AT-MISSING-UNKNOWN-INDEPENDENT-REVIEW-001",
  "as_of": "2026-08-16",
  "task_id": "RC002-H11-CREATE-AT-MISSING-UNKNOWN-OFFLINE-V1",
  "reviewed_bindings_sha256": "be524d5487712e469fd80013189537e5aca7aa63bf0d73d13b785968207e1a70",
  "reviewed_inventory_sha256": "0000000000000000000000000000000000000000000000000000000000000000",
  "required_roles": [
    "CODE_REVIEWER",
    "GOAL_DOD_CRITIC",
    "ARCHITECTURE_CRITIC"
  ],
  "reviews": [
    {
      "role": "CODE_REVIEWER",
      "verdict": "PASS",
      "findings": [
        "CHECKED_WRITE_SET_BOUNDED",
        "CHECKED_PINNED_DECODER_NOT_IN_WRITE_SET",
        "CHECKED_NO_DECODE_PUMP_PROGRAM_DATA",
        "CHECKED_NO_BLOCKTIME_AS_CREATE_AT",
        "CHECKED_NO_I64_CLOCK_EMITTED",
        "CHECKED_CREATE_AT_JSON_NULL",
        "CHECKED_CREATE_AT_STATUS_MISSING_UNKNOWN",
        "CHECKED_TASK40_NAMED_MINT_AND_CURVE_FAIL_CLOSED",
        "CHECKED_IDENTITY_TERMINAL_CREATE_PUBKEYS_MATCH_NAMED_MINT_AND_BONDING_CURVE",
        "CHECKED_LAYOUT_TERMINAL_CREATE_EARLY_LAYOUT_BORSH_CONSUMED_TIMESTAMP_INVARIANT",
        "CHECKED_PREREQUISITE_DRIFT_CLEARS_STATUS",
        "CHECKED_TASK37_YAML_NOT_REWRITTEN",
        "CHECKED_NO_TASK40_TASK39_PRIOR_H11_RECEIPT_REWRITE",
        "CHECKED_NETWORK_OFFLINE",
        "CHECKED_NO_SECRETS",
        "CHECKED_NO_SKIPTEST",
        "CHECKED_OWNER_DECISION_A",
        "CHECKED_ACCEPTANCE_AND_RUSSIAN_READOUT_ALIGN"
      ]
    },
    {
      "role": "GOAL_DOD_CRITIC",
      "verdict": "PASS",
      "findings": [
        "CHECKED_DECISION_DELTA",
        "CHECKED_NAMED_CONSUMER",
        "CHECKED_CHEAPEST_FALSIFIER",
        "CHECKED_NON_CLAIMS",
        "CHECKED_USER_VISIBLE",
        "CHECKED_EVIDENCE_BUDGET",
        "CHECKED_DOD"
      ]
    },
    {
      "role": "ARCHITECTURE_CRITIC",
      "verdict": "PASS",
      "findings": [
        "CHECKED_WRITE_SET",
        "CHECKED_TRUTH_OWNERSHIP",
        "CHECKED_COMPATIBILITY",
        "CHECKED_BLAST_RADIUS",
        "CHECKED_RECOVERY",
        "CHECKED_PRIVATE_API",
        "CHECKED_DUCKDB",
        "CHECKED_TASK37_CLOCK_FREEZE",
        "CHECKED_PINNED_DECODER",
        "CHECKED_PIT_NONCLAIM",
        "CHECKED_CREATE_AT_NULL",
        "CHECKED_IMPORT_SURFACE",
        "CHECKED_ACCEPTANCE_EQUALS_BINDER_OUTPUT"
      ]
    }
  ],
  "verdict": "PASS",
  "non_claims": [
    "NO_CRYPTOGRAPHIC_REVIEWER_IDENTITY",
    "REVIEW_IS_NOT_SEMANTIC_DONE",
    "NO_LIVE_PIT_OR_EXECUTION_CLAIM",
    "NO_TASK40_RECEIPT_REWRITE"
  ]
}
