{
  "schema": "smial.delivery-independent-review-evidence",
  "schema_version": "1.0",
  "review_id": "RC002-H11-CREATE-SIX-FIELD-PUBKEY-IDENTITY-INDEPENDENT-REVIEW-001",
  "as_of": "2026-08-16",
  "task_id": "RC002-H11-CREATE-SIX-FIELD-PUBKEY-IDENTITY-OFFLINE-V1",
  "reviewed_bindings_sha256": "e96f636bd05c7f75a591d466acdee60076a91ca897b7478ec23418e8d84bb6af",
  "reviewed_inventory_sha256": "877ecc608412978afb678792b39766eb5799f5c032779d81a54942a65a2dc282",
  "required_roles": [
    "CODE_REVIEWER",
    "GOAL_DOD_CRITIC",
    "ARCHITECTURE_CRITIC"
  ],
  "reviews": [
    {
      "role": "CODE_REVIEWER",
      "verdict": "PASS",
      "findings": [
        "CHECKED_WRITE_SET_EXCLUDES_PINNED_DECODER",
        "CHECKED_NO_DECODE_PUMP_PROGRAM_DATA_CALL",
        "CHECKED_NO_PRIVATE_DECODER_IMPORTS",
        "CHECKED_TASK40_IDENTITY_FAIL_CLOSED",
        "CHECKED_GIT_FIXTURE_195_PUBKEYS_MATCH",
        "CHECKED_TERMINALS",
        "CHECKED_NO_BLOCKTIME_AS_CREATE_AT",
        "CHECKED_A4_OPTIONAL_DUAL_PATH",
        "CHECKED_NO_SKIPTEST",
        "CHECKED_NETWORK_OFFLINE",
        "CHECKED_NO_SECRETS",
        "CHECKED_NO_HISTORICAL_RECEIPT_MUTATION",
        "CHECKED_ACCEPTANCE_AND_READOUT_ALIGN"
      ]
    },
    {
      "role": "GOAL_DOD_CRITIC",
      "verdict": "PASS",
      "findings": [
        "CHECKED_DECISION_DELTA",
        "CHECKED_NAMED_CONSUMER",
        "CHECKED_CHEAPEST_FALSIFIER",
        "CHECKED_DOD_1_READER",
        "CHECKED_DOD_2_TASK40",
        "CHECKED_DOD_3_GIT_FIXTURE",
        "CHECKED_DOD_4_OPTIONAL_A4",
        "CHECKED_DOD_5_NON_CLAIMS",
        "CHECKED_DOD_6_TESTS_AND_REVIEW",
        "CHECKED_WRITE_SET",
        "CHECKED_EVIDENCE_BUDGET",
        "CHECKED_USER_VISIBLE"
      ]
    },
    {
      "role": "ARCHITECTURE_CRITIC",
      "verdict": "PASS",
      "findings": [
        "CHECKED_TRUTH_OWNERSHIP_GIT_FIXTURE_AND_TASK40",
        "CHECKED_NO_PRIVATE_CROSS_TASK_IMPORTS",
        "CHECKED_NO_DECODER_FORK_OR_DECODE_CALL",
        "CHECKED_A4_OPTIONAL_NOT_CI_REPRODUCIBLE",
        "CHECKED_NO_CREATE_AT_FROM_BLOCKTIME",
        "CHECKED_DUCKDB_NOT_IN_PATH",
        "CHECKED_LOG_WALKER_DUPLICATED_NOT_PRIVATE_IMPORT",
        "CHECKED_MATCH_IS_NOT_CREATE_AT_AVAILABILITY",
        "CHECKED_SYNTHETIC_TESTS_TAUTOLOGICAL_WITHOUT_FIXTURE"
      ]
    }
  ],
  "verdict": "PASS",
  "non_claims": [
    "NO_CRYPTOGRAPHIC_REVIEWER_IDENTITY",
    "REVIEW_IS_NOT_SEMANTIC_DONE",
    "NO_LIVE_PIT_OR_EXECUTION_CLAIM",
    "NO_TASK40_RECEIPT_REWRITE"
  ]
}
