{
  "schema": "smial.delivery-independent-review-evidence",
  "schema_version": "1.0",
  "review_id": "RC002-H11-BOUNDED-GETTRANSACTION-CREATE-INDEPENDENT-REVIEW-001",
  "as_of": "2026-08-16",
  "task_id": "RC002-H11-BOUNDED-GETTRANSACTION-CREATE-V1",
  "reviewed_bindings_sha256": "f46449882ecbe238da60e0bd84df21fe48b9c1632d4be8d28c88e76fae3a88ef",
  "reviewed_inventory_sha256": "bd0d453fb233465e9fe0680346a8d39683943da33fef8b6415d6615c1c26507d",
  "required_roles": [
    "CODE_REVIEWER",
    "GOAL_DOD_CRITIC",
    "ARCHITECTURE_CRITIC"
  ],
  "reviews": [
    {
      "role": "CODE_REVIEWER",
      "verdict": "PASS",
      "findings": [
        "CHECKED_PINNED_DECODER_NOT_IN_WRITE_SET",
        "CHECKED_PINNED_SIGNATURE_ONLY",
        "CHECKED_NO_HELIUS_API_KEY_ENV",
        "CHECKED_NO_RETRY",
        "CHECKED_DNS_TCP_PREFLIGHT_BEFORE_POST",
        "CHECKED_MAX_ONE_REQUEST",
        "CHECKED_PUBLIC_CANDIDATE_DROP_QUOTE_MINT_AND_VIRTUAL_QUOTE_RESERVES",
        "CHECKED_NO_SKIPTEST",
        "CHECKED_NO_PRIVATE_DECODER_IMPORTS",
        "CHECKED_FROZEN_LIVE_RECEIPT"
      ]
    },
    {
      "role": "GOAL_DOD_CRITIC",
      "verdict": "PASS",
      "findings": [
        "CHECKED_LIVE_TERMINAL_CREATE_GETTX_SAME_195_STILL_TRUNCATED",
        "CHECKED_USEFUL_TO_RC002_H11_LIFECYCLE_CLOCK_PUBLIC_GETTX_DOES_NOT_RECOVER_LONGER_CREATE",
        "CHECKED_DOD3_SAME_195_IS_NOT_EXCLUSIVE_XB_RPC_CUT",
        "CHECKED_NON_CLAIMS_NO_EXCLUSIVE_XB_RPC_CUT_CLAIM_NO_LIVE_PIT_CLAIM_NO_TASK40_RECEIPT_REWRITE_NO_HELIUS_CALL",
        "CHECKED_EVIDENCE_BUDGET_ONE_POST_MAX_2MB_RESPONSE_11246",
        "CHECKED_NO_UNPROVEN_SKIPTEST"
      ]
    },
    {
      "role": "ARCHITECTURE_CRITIC",
      "verdict": "PASS",
      "findings": [
        "CHECKED_PINNED_DECODER_NOT_MUTATED",
        "CHECKED_CANDIDATE_PLAN_IS_DERIVED_NOT_PINNED_TRUTH",
        "CHECKED_NO_HELIUS_NO_CREDENTIAL",
        "CHECKED_ROUTE_V3_ADOPTED_V1_NOT_REWRITTEN",
        "CHECKED_SAME_195_NOT_EXCLUSIVE_XB_RPC_CUT",
        "CHECKED_SAME_195_IS_LOG_LENGTH_NOT_BYTE_IDENTITY_OR_INNER_IX",
        "CHECKED_A4_GITIGNORED_CI_WILL_NOT_RECALL_RPC",
        "CHECKED_LIVE_PIT_FALSE",
        "CHECKED_NO_PRIVATE_TASK_API_IMPORT"
      ]
    }
  ],
  "verdict": "PASS",
  "non_claims": [
    "NO_CRYPTOGRAPHIC_REVIEWER_IDENTITY",
    "REVIEW_IS_NOT_SEMANTIC_DONE",
    "NO_LIVE_PIT_OR_EXECUTION_CLAIM",
    "NO_TASK40_RECEIPT_REWRITE"
  ]
}
