{"as_of":"2026-08-20","non_claims":["NO_CRYPTOGRAPHIC_REVIEWER_IDENTITY","REVIEW_IS_NOT_SEMANTIC_DONE","NO_FACTORY_V1_OPERATIONAL_READY","NO_ALPHA_OR_CASHFLOW","NO_ATOM_2","NO_CANONICAL_DONE","NO_VPS_PURCHASE_OR_DEPLOY","NO_SCIENTIFIC_RECLASSIFICATION_OF_PR_156","NO_RECAPTURE","NO_TRADED_ONLY_RESCUE","NO_POST_HOC_THRESHOLD_SEARCH"],"required_roles":["ARCHITECTURE_CRITIC","CODE_REVIEWER","GOAL_DOD_CRITIC"],"review_id":"QUOTE-SURFACE-RETENTION-CONFIRMATORY-INDEPENDENT-REVIEW-001","reviewed_bindings_sha256":"0852445f441c84754d9a4df67a42491d6152cf7f8fb2fd59f6efbc27c36808b2","reviewed_inventory_sha256":"888c1f597303c216a10cc1448c70f8425943ddbe71657979032b757526d50cb0","reviews":[{"findings":["CHECKED_PHRASE_MISMATCH_BLOCKS_ZERO_CALLS","CHECKED_EXCLUSIONS_A1_MOVE2_COMMISSIONING_ATOM5_ATOM6_PR156","CHECKED_LIVE_FROZEN_CELLS_NO_EXCLUDED_MINT_REUSE","CHECKED_OVERLAY_STILL_PINS_CONSUMED_PR156","CHECKED_NO_API_KEY_IN_RECEIPTS_OR_GIT","CHECKED_RUNNER_HAS_NO_RETENTION_DELTA_OR_QUOTE_SURFACE_RETENTION_LOGIC","CHECKED_KEEP_VETO_Y_FROZEN_NO_TRADED_ONLY_RESCUE_NO_POST_HOC","CHECKED_TESTS_PHRASE_GATE_PR156_EXCLUSION_OVERLAY_PIN_LIVE_FAMILY_CLOSE","CHECKED_NO_WALLET_EXECUTE_PAID_PLAN_SECOND_PROVIDER","CHECKED_LIVE_RECEIPT_SHA256_AND_CLOSE_EXACT_QUOTE_SURFACE_RETENTION_FAMILY","CHECKED_WRAP_CAPTURE_PLUS_RETENTION_PROJECTOR_NO_NEW_RUNNER_LOGIC"],"role":"CODE_REVIEWER","verdict":"PASS"},{"findings":["CHECKED_NAMED_CONSUMER_ATOM2_NOT_EARNED","CHECKED_DECISION_DELTA_CLOCKED_KEEP_VS_BASELINE","CHECKED_CHEAPEST_FALSIFIER_RAN_NO_MEDIAN_OR_TAIL_UPLIFT","CHECKED_DOD1_EXPERIMENTSPEC_CAPTURE_POLICY_FACTORY_SELECTOR","CHECKED_DOD2_PHRASE_MISMATCH_BLOCKED_AUTHORITY_ZERO_CALLS","CHECKED_DOD3_EXCLUSIONS_A1_MOVE2_COMMISSIONING_ATOM5_ATOM6_PR156","CHECKED_DOD4_OVERLAY_PINS_CONSUMED_156_SAMPLE_INVALID","CHECKED_DOD5_FRESH_6PLUS6_HASH_BOUND_CATALOG_OWNER_READOUT","CHECKED_VALID_CELLS_RECENT_5_TRADED_6_FLOOR_MET","CHECKED_CLOCK_VALID_TIME_SEPARATION_BOTH_STRATA","CHECKED_KEEP_MEDIAN_P90_NOT_BETTER_THAN_BASELINE","CHECKED_OWNER_READOUT_HONEST_FAMILY_CLOSE_NOT_156_REWRITE","CHECKED_NONCLAIMS_NO_ALPHA_NO_REGISTRY_SEED_NOT_ATOM2","CHECKED_NONGOALS_ATOM234_VPS_RC001_ATOM56_UNTOUCHED"],"role":"GOAL_DOD_CRITIC","verdict":"PASS"},{"findings":["CHECKED_ADOPT_FREE_KEY_ORDER","CHECKED_WRAP_RETENTION_SCHEDULE_AND_PROJECTOR","CHECKED_FORK_ATOM_PHRASE_EXCLUSIONS_POLICY_SPEC_SELECTOR","CHECKED_NO_NEW_RUNNER_LOGIC","CHECKED_SCHEMA_SELECTOR_FORK","CHECKED_CONFIRMATORY_SELECTOR_PREFERENCE","CHECKED_OVERLAY_PINS_PR156_AND_FAMILY_TERMINALS","CHECKED_WRAP_RESIDUALS_HONEST_Y_AND_FAMILY_CLOSE","CHECKED_EXCLUSIONS_INCLUDE_PR156","CHECKED_KEEP_VETO_Y_FROZEN","CHECKED_CLOCK_VALID_FROM_DUE_OBSERVED_TERMINAL_ONLY","CHECKED_UNKNOWN_NOT_ZERO_NOT_VETO","CHECKED_STRATA_NOT_POOLED_FOR_PASS","CHECKED_KERNEL_PROVIDER_CALLS_FALSE","CHECKED_CASH_ZERO_NO_WALLET_SIGNER_TX","CHECKED_NO_CROSS_TASK_PRIVATE_IMPORT","CHECKED_GIT_JSON_TRUTH_IF_DUCKDB_GONE","CHECKED_CATALOG_HASH_BINDINGS","CHECKED_RECOVERY_REVERT_CREATE_ONLY_156","CHECKED_NO_GENERIC_PLATFORM"],"role":"ARCHITECTURE_CRITIC","verdict":"PASS"}],"schema":"smial.delivery-independent-review-evidence","schema_version":"1.0","task_id":"QUOTE_SURFACE_RETENTION_CONFIRMATORY_V1","verdict":"PASS"}
