{
  "schema": "smial.delivery-independent-review-evidence",
  "schema_version": "1.0",
  "as_of": "2026-10-09",
  "task_id": "FORGE_RESEARCH_FLOW_RELIABILITY_V1",
  "review_id": "FORGE_RESEARCH_FLOW_RELIABILITY_V1-REVIEW",
  "reviewed_bindings_sha256": "5084efd8f17efe500d79aab7e8ac8995e2f4ab7acacb972ef97d65e84489d2c7",
  "reviewed_inventory_sha256": "cd5e2407ca183cf0e6827229674577760585a0e6ace3eafc35b5a84dae73fb33",
  "required_roles": [
    "CODE_REVIEWER",
    "GOAL_DOD_CRITIC",
    "ARCHITECTURE_CRITIC",
    "OWNER_UX_CRITIC"
  ],
  "reviews": [
    {
      "role": "CODE_REVIEWER",
      "verdict": "PASS",
      "findings": [
        "EXACT_HEAD_LEGACY_CRITIC_SCHEMA_NEW_DRAFT_REFUSAL_AND_RECOVERY_NO_P0_P1"
      ]
    },
    {
      "role": "GOAL_DOD_CRITIC",
      "verdict": "PASS",
      "findings": [
        "D01_D17_FALSIFIERS_D15_MEASURED_RECOVERY_D18_LIVE_BLOCKED_NO_P0_P1"
      ]
    },
    {
      "role": "ARCHITECTURE_CRITIC",
      "verdict": "PASS",
      "findings": [
        "LINEAGE_PIT_SLOT_RESERVATION_LATE_CONTEXT_WRITE_NO_P0_P1"
      ]
    },
    {
      "role": "OWNER_UX_CRITIC",
      "verdict": "PASS",
      "findings": [
        "SLOT_OWNER_FOCUS_AND_INVENTORY_DELTA_SAFE_RECOVERY_NO_P0_P1"
      ]
    }
  ],
  "verdict": "PASS",
  "non_claims": [
    "NO_MODEL_DIVERSITY_PROOF",
    "NO_CRYPTOGRAPHIC_REVIEWER_IDENTITY",
    "NO_SCIENTIFIC_ACCEPTANCE",
    "NO_MERGE"
  ]
}
