{
  "schema": "smial.delivery-independent-review-evidence",
  "schema_version": "1.0",
  "review_id": "HARNESS-SYNC-DELIVERY-EVIDENCE-BINDINGS-REVIEW-001",
  "as_of": "2026-08-22",
  "task_id": "CTRL-HARNESS-SYNC-DELIVERY-EVIDENCE-BINDINGS-V1",
  "reviewed_bindings_sha256": "9322251f6e85c51308a495f1badaae5e0b2cd9743b439d46f9ad04b541e1f8af",
  "reviewed_inventory_sha256": "41fb1c1c7a54f7609c3f55faaea743446eed5dece676875cc0df338577966f07",
  "required_roles": [
    "CODE_REVIEWER",
    "GOAL_DOD_CRITIC",
    "ARCHITECTURE_CRITIC"
  ],
  "reviews": [
    {
      "role": "CODE_REVIEWER",
      "verdict": "PASS",
      "findings": []
    },
    {
      "role": "GOAL_DOD_CRITIC",
      "verdict": "PASS",
      "findings": []
    },
    {
      "role": "ARCHITECTURE_CRITIC",
      "verdict": "PASS",
      "findings": []
    }
  ],
  "verdict": "PASS",
  "non_claims": [
    "NO_CRYPTOGRAPHIC_REVIEWER_IDENTITY"
  ]
}
