{
  "as_of": "2026-08-19",
  "non_claims": [
    "NO_CRYPTOGRAPHIC_REVIEWER_IDENTITY",
    "REVIEW_IS_NOT_SEMANTIC_DONE",
    "NO_FACTORY_V1_OPERATIONAL_READY",
    "NO_ALPHA_OR_CASHFLOW",
    "NO_MOVE_3",
    "NO_CANONICAL_DONE",
    "NO_VPS"
  ],
  "required_roles": [
    "ARCHITECTURE_CRITIC",
    "CODE_REVIEWER",
    "GOAL_DOD_CRITIC"
  ],
  "review_id": "FACTORY-V1-COMMISSIONING-INDEPENDENT-REVIEW-001",
  "reviewed_bindings_sha256": "d00df2606d27368d72f49e5b852cbc117259da4e42f0c2bf315a252867cd667c",
  "reviewed_inventory_sha256": "7aa1398cb6a5d1f609f148be769812abd7ca5907b8087b39444ff9af5ec80e52",
  "reviews": [
    {
      "findings": [
        "CHECKED_NO_RECAPTURE_AFTER_HASH_BOUND_RECEIPT",
        "CHECKED_COMPLETE_JOB_NOT_CLOBBERED_TO_BLOCKED_AUTHORITY",
        "CHECKED_FAIL_CLOSED_PHRASE_WHILE_CAPTURE_MISSING",
        "CHECKED_NO_KEY_IN_RECEIPTS",
        "CHECKED_GENERIC_RUNNER_HAS_NO_HYPOTHESIS_LOGIC",
        "CHECKED_WRAP_RUN_CAMPAIGN_AND_CLASSIFY_AUDITION_TERMINAL",
        "CHECKED_A1_MOVE2_MINT_EXCLUSION",
        "CHECKED_NO_PRODUCTION_REGISTRY_SEED",
        "CHECKED_NO_FACTORY_V1_OPERATIONAL_READY"
      ],
      "role": "CODE_REVIEWER",
      "verdict": "PASS"
    },
    {
      "findings": [
        "CHECKED_TEN_FIELD_OWNER_PACKET",
        "CHECKED_SCIENTIFIC_HINT_MAY_BE_PRODUCT_PASS",
        "CHECKED_CHEAPEST_FALSIFIER_NOT_TRIPPED",
        "CHECKED_NO_MOVE_3",
        "CHECKED_NO_ALPHA_OR_NETRETURN",
        "CHECKED_NO_FACTORY_V1_OPERATIONAL_READY",
        "CHECKED_GOLDEN_BUDGET_ZERO_REMAINS",
        "CHECKED_DEFAULT_SPEC_IS_COMMISSIONING"
      ],
      "role": "GOAL_DOD_CRITIC",
      "verdict": "PASS"
    },
    {
      "findings": [
        "CHECKED_GIT_REMAINS_SCIENCE_AFTER_SECOND_START",
        "CHECKED_SQLITE_UI_PROJECTION_ONLY",
        "CHECKED_KERNEL_PROVIDER_CALLS_FALSE",
        "CHECKED_WRAP_NOT_NEW_CORE_RUNNER",
        "CHECKED_LIVE_PHRASE_GATE_WHEN_RECEIPT_MISSING",
        "CHECKED_HASH_MISMATCH_IS_BLOCKED_DATA_NOT_RECAPTURE",
        "CHECKED_EMPTY_PRODUCTION_REGISTRIES",
        "CHECKED_HOLDOUT_NOT_CONSUMED"
      ],
      "role": "ARCHITECTURE_CRITIC",
      "verdict": "PASS"
    }
  ],
  "schema": "smial.delivery-independent-review-evidence",
  "schema_version": "1.0",
  "task_id": "FACTORY_V1_COMMISSIONING_HYPOTHESIS_V1",
  "verdict": "PASS"
}
