{
  "as_of": "2026-08-25",
  "non_claims": [
    "NO_CRYPTOGRAPHIC_REVIEWER_IDENTITY",
    "REVIEW_IS_NOT_SEMANTIC_DONE",
    "NO_PRODUCTION_SELECTOR",
    "NO_ALPHA_PNL_OR_NETRETURN",
    "NO_CANONICAL_DONE",
    "NO_SINGLE_AGENT_REVIEW_FALLBACK",
    "NO_UNIT_FACT",
    "NO_COMBINED_NOT_FLOOR_TERMINAL",
    "NO_AUTOMATIC_NEXT"
  ],
  "required_roles": [
    "ARCHITECTURE_CRITIC",
    "CODE_REVIEWER",
    "GOAL_DOD_CRITIC"
  ],
  "review_id": "BUY-DT-QUOTE-MS-ASSOCIATION-INDEPENDENT-REVIEW-001",
  "reviewed_bindings_sha256": "a3b1046a71c2ac534ac4842928d9df161c1b6b19502b4332b984eeb156f8025c",
  "reviewed_inventory_sha256": "f2276e1ac8f83673a1a11f68ca781cd35c3e42cfc94d43ffe371d84c3489df00",
  "reviews": [
    {
      "findings": [
        "CHECKED_BUY_T0_ONLY_PRIMARY",
        "CHECKED_W_VL_NOT_IN_PRIMARY_OR_VOTE",
        "CHECKED_ROUTEPLAN_GATES_NOT_PREDICTORS",
        "CHECKED_Y_COPIED_NOT_RELABELED",
        "CHECKED_TAILS_NOT_POOLED_FOR_TERMINAL",
        "CHECKED_DROP_CANNOT_UPGRADE",
        "CHECKED_NO_P_VALUE",
        "CHECKED_NO_SELECTOR",
        "CHECKED_CAPSULE_HAS_HASH_AND_EXTRACTOR",
        "CHECKED_CAPSULE_REAPPLIES_GATES",
        "CHECKED_FROM_CAPSULE_REPLAY",
        "CHECKED_ZERO_PROVIDER_CALLS",
        "CHECKED_NO_SECRETS_OR_TAKER_TRANSACTION"
      ],
      "role": "CODE_REVIEWER",
      "verdict": "PASS"
    },
    {
      "findings": [
        "CHECKED_DECISION_DELTA",
        "CHECKED_NAMED_CONSUMER",
        "CHECKED_CHEAPEST_FALSIFIER_SEMANTICS_THEN_REPRO",
        "CHECKED_MUTEX_TERMINAL_NULL_CLOSE",
        "CHECKED_WEAKER_OF_FAMILIES",
        "CHECKED_NO_AUTOMATIC_NEXT",
        "CHECKED_NON_CLAIMS"
      ],
      "role": "GOAL_DOD_CRITIC",
      "verdict": "PASS"
    },
    {
      "findings": [
        "CHECKED_NO_FACTORY_PYTHON_FORK",
        "CHECKED_NO_CONTEXT_MAP_MIGRATION",
        "CHECKED_NO_DISCOVERY_OR_SELECTOR_SURFACE",
        "CHECKED_A4_STAYS_OUTSIDE_GIT",
        "CHECKED_CAPSULE_RECOMPUTES_WITHOUT_A4",
        "CHECKED_ARCH_INTENT_006_REMAINS_WATCH_ONLY",
        "CHECKED_BLAST_RADIUS_TASK_LOCAL",
        "RESIDUAL_SEASONED_30M_HAS_NO_CATALOG_CTRL_ASSET"
      ],
      "role": "ARCHITECTURE_CRITIC",
      "verdict": "PASS"
    }
  ],
  "schema": "smial.delivery-independent-review-evidence",
  "schema_version": "1.0",
  "task_id": "BUY_DECISION_TIME_QUOTE_MICROSTRUCTURE_ASSOCIATION_V1",
  "verdict": "PASS"
}
